{
  "contractVersion": "condition@0.1.0",
  "schemaId": "condition",
  "schemaVersion": 1,
  "type": "any",
  "operands": [
    {
      "type": "constant",
      "value": false,
      "contractVersion": "condition@0.1.0",
      "schemaId": "condition",
      "schemaVersion": 1
    },
    {
      "type": "exists",
      "selector": {
        "domainId": "state-domain.core.clock",
        "path": "/tick"
      },
      "contractVersion": "condition@0.1.0",
      "schemaId": "condition",
      "schemaVersion": 1
    }
  ]
}
